<?xml version="1.0"?>
<database xmlns:xsi="http://www.w3.org/2001/XMLSchema-instance"
          xsi:noNamespaceSchemaLocation="../../../release/database.xsd">
    <table>
        <name>name</name>
        <declaration>
            <index>
                <name>hi</name>
                <field>
                    <name>hi2</name>
                    <some></some>
                </field>
            </index>
        </declaration>
    </table>
</database>
